{
  "name": "instagram_4x5",
  "io": {
    "preserve_metadata": true,
    "exif_transpose": false
  },
  "tone": {
    "exposure_ev": 0.06,
    "contrast": 0.08,
    "black_point": 0.01,
    "white_point": 0.01
  },
  "color": {
    "saturation": 0.05,
    "vibrance": 0.06,
    "wb_mode": "none"
  },
  "detail": {
    "denoise_strength": 0.06,
    "sharpen_amount": 0.35,
    "sharpen_radius": 1.0
  },
  "geometry": {
    "enabled": true,
    "crop": {
      "enabled": false,
      "x": 0,
      "y": 0,
      "width": 1,
      "height": 1
    },
    "resize": {
      "enabled": true,
      "width": 1080,
      "height": 1350,
      "resample": "lanczos"
    }
  },
  "safety": {
    "max_channel_clip_pct": 5.0,
    "clip_eval_mode": "any_channel",
    "clip_black_level": 0,
    "clip_white_level": 255,
    "no_geometry_change": false,
    "identical_composition_expected": false,
    "max_translation_pixels": 0.0,
    "pixel_diff_gate": false,
    "max_mae": 0.5,
    "max_diff_pixels_pct": 0.5
  },
  "export": {
    "keep_png_master": true,
    "web_enabled": true,
    "web_format": "jpeg",
    "web_quality": 90,
    "embed_profile": true
  }
}
